{"architecture_gates":["G13","G17"],"artifact_id":"response_update_trace","assertions":[{"assertion_id":"all_heads_consume_post_response_state","expected":["a9dd76f6b15eee0248ade58b20978d344f65aeeacd2db6af24a70ffdc6e6fb5a"],"observed":["a9dd76f6b15eee0248ade58b20978d344f65aeeacd2db6af24a70ffdc6e6fb5a"],"passed":true}],"case_blind":true,"errors":[],"gate_ids":["PL-ACT-002"],"generated_at":"2026-07-20T22:18:37Z","inputs":[{"path":"ARCHITECTURE_FINAL_v1.md","role":"frozen_architecture_contract","sha256":"d83b910f3cd32c777f126b245c2652e88fccb31aaa125b455f4c5af90cc4575c"},{"path":"architecture_final_v1.schema.json","role":"frozen_wire_schema","sha256":"9804d21e8032f571b6cfd414c08b31891eab8856bc0502e0000df4b7d53f80d1"},{"path":"holdout/PERFECT_LANDING_GATES.json","role":"frozen_perfect_landing_gate_contract","sha256":"a00b963fd090d4accb304b343075661a5bfd6ecf2fc8371843a0a974e9fe3798"},{"path":"runtime_v2/examples/neutral_factorial_model.json","role":"abstract_case_blind_runtime_fixture","sha256":"7b0e2b4322b6af10d33f6fa09f87c77c4b1abd2ee583c0b589a154818be71510"}],"limitations":[],"metrics":{},"outputs":{"consumed":["a9dd76f6b15eee0248ade58b20978d344f65aeeacd2db6af24a70ffdc6e6fb5a"],"post":"a9dd76f6b15eee0248ade58b20978d344f65aeeacd2db6af24a70ffdc6e6fb5a","pre":"84c5d8fd2c13d995c22cde7866d20497299170a662d1e91ad0ef92e793cff09f"},"produced_by":"holdout/tools/structural_gate_harness.py","schema_version":"ncf.structural-gate-evidence.v1","status":"PASS","summary":"Observed response updates the shared state consumed by all heads."}
