{"architecture_gates":["G08"],"artifact_id":"local_mode_trace","assertions":[{"assertion_id":"simultaneous_local_modes","expected":{"PROCESS_A":"recovering","PROCESS_B":"decompensated"},"observed":{"PROCESS_A":"recovering","PROCESS_B":"decompensated"},"passed":true}],"case_blind":true,"errors":[],"gate_ids":["PL-MODE-001"],"generated_at":"2026-07-20T23:18:44Z","inputs":[{"path":"ARCHITECTURE_FINAL_v1.md","role":"frozen_architecture_contract","sha256":"d83b910f3cd32c777f126b245c2652e88fccb31aaa125b455f4c5af90cc4575c"},{"path":"architecture_final_v1.schema.json","role":"frozen_wire_schema","sha256":"9804d21e8032f571b6cfd414c08b31891eab8856bc0502e0000df4b7d53f80d1"},{"path":"holdout/PERFECT_LANDING_GATES.json","role":"frozen_perfect_landing_gate_contract","sha256":"74a4e50e1b093848ba679e6ab218d68e29306166f27dfdaaccfdf09e46576b3c"},{"path":"runtime_v2/examples/neutral_factorial_model.json","role":"abstract_case_blind_runtime_fixture","sha256":"7b0e2b4322b6af10d33f6fa09f87c77c4b1abd2ee583c0b589a154818be71510"}],"limitations":[],"metrics":{},"outputs":{"mode_posteriors":{"PROCESS_A":{"compensated":0.42857142857142855,"decompensated":0.043956043956043966,"recovering":0.5274725274725274},"PROCESS_B":{"compensated":0.38888888888888884,"decompensated":0.5925925925925927,"recovering":0.018518518518518524}}},"produced_by":"holdout/tools/structural_gate_harness.py","schema_version":"ncf.structural-gate-evidence.v1","status":"PASS","summary":"Different processes may occupy opposite local modes simultaneously."}
