{"architecture_gates":["G10"],"artifact_id":"geometry_witness","assertions":[{"assertion_id":"topology_changes_neighbor_inference","expected":true,"observed":true,"passed":true}],"case_blind":true,"errors":[],"gate_ids":["PL-GEOM-001"],"generated_at":"2026-07-21T09:11:12+09:00","inputs":[{"path":"ARCHITECTURE_FINAL_v1.md","role":"frozen_architecture_contract","sha256":"d83b910f3cd32c777f126b245c2652e88fccb31aaa125b455f4c5af90cc4575c"},{"path":"architecture_final_v1.schema.json","role":"frozen_wire_schema","sha256":"9804d21e8032f571b6cfd414c08b31891eab8856bc0502e0000df4b7d53f80d1"},{"path":"holdout/PERFECT_LANDING_GATES.json","role":"frozen_perfect_landing_gate_contract","sha256":"74a4e50e1b093848ba679e6ab218d68e29306166f27dfdaaccfdf09e46576b3c"},{"path":"runtime_v2/examples/neutral_factorial_model.json","role":"abstract_case_blind_runtime_fixture","sha256":"5b9f4386b24a070afeaa0967dcf46813195945d10fc175a05dc3aebe5d7283ff"}],"limitations":[],"metrics":{},"outputs":{"distances":{"A_B":1,"A_C":4},"off":{"NCF_UNMODELED_PROCESS":0.12000000000000009,"PROCESS_A":0.8105603676416377,"PROCESS_B":0.1771851285273873,"PROCESS_C":0.10000000000000005},"on":{"NCF_UNMODELED_PROCESS":0.12000000000000008,"PROCESS_A":0.8115250277670384,"PROCESS_B":0.22038476585523073,"PROCESS_C":0.10336352057545886}},"produced_by":"holdout/tools/structural_gate_harness.py","schema_version":"ncf.structural-gate-evidence.v1","status":"PASS","summary":"Branch geometry changes clinically relevant neighborhood influence."}
