{"architecture_gates":["G02"],"artifact_id":"planned_performed_probe","assertions":[{"assertion_id":"planned_is_record_only","expected":true,"observed":true,"passed":true}],"case_blind":true,"errors":[],"gate_ids":["PL-TIME-002"],"generated_at":"2026-07-20T23:18:44Z","inputs":[{"path":"ARCHITECTURE_FINAL_v1.md","role":"frozen_architecture_contract","sha256":"d83b910f3cd32c777f126b245c2652e88fccb31aaa125b455f4c5af90cc4575c"},{"path":"architecture_final_v1.schema.json","role":"frozen_wire_schema","sha256":"9804d21e8032f571b6cfd414c08b31891eab8856bc0502e0000df4b7d53f80d1"},{"path":"holdout/PERFECT_LANDING_GATES.json","role":"frozen_perfect_landing_gate_contract","sha256":"74a4e50e1b093848ba679e6ab218d68e29306166f27dfdaaccfdf09e46576b3c"},{"path":"runtime_v2/examples/neutral_factorial_model.json","role":"abstract_case_blind_runtime_fixture","sha256":"7b0e2b4322b6af10d33f6fa09f87c77c4b1abd2ee583c0b589a154818be71510"}],"limitations":[],"metrics":{},"outputs":{"planned_instances":[{"action_id":"ACTION_REDUCE_A","action_instance_id":"planned:plan","completed_cursor":null,"cumulative_exposure":{"unit":"none","value":0},"dose_history":[],"held_cursor":null,"planned_cursor":1,"response_summaries":[],"source_event_ids":["plan"],"started_cursor":null,"status":"planned","stopped_cursor":null,"washout":{"estimated_remaining_fraction":0,"residual_effect_probability":0}}]},"produced_by":"holdout/tools/structural_gate_harness.py","schema_version":"ncf.structural-gate-evidence.v1","status":"PASS","summary":"Planned and performed actions are not conflated."}
