{"architecture_gates":["G06"],"artifact_id":"directional_likelihood_assertions","assertions":[{"assertion_id":"positive_and_negative_directions","expected":"positive>prior>negative","observed":{"negative":0.011652802086968657,"positive":0.8115250277670384,"prior":0.18380414700826223},"passed":true}],"case_blind":true,"errors":[],"gate_ids":["PL-FACT-001"],"generated_at":"2026-07-20T22:18:37Z","inputs":[{"path":"ARCHITECTURE_FINAL_v1.md","role":"frozen_architecture_contract","sha256":"d83b910f3cd32c777f126b245c2652e88fccb31aaa125b455f4c5af90cc4575c"},{"path":"architecture_final_v1.schema.json","role":"frozen_wire_schema","sha256":"9804d21e8032f571b6cfd414c08b31891eab8856bc0502e0000df4b7d53f80d1"},{"path":"holdout/PERFECT_LANDING_GATES.json","role":"frozen_perfect_landing_gate_contract","sha256":"a00b963fd090d4accb304b343075661a5bfd6ecf2fc8371843a0a974e9fe3798"},{"path":"runtime_v2/examples/neutral_factorial_model.json","role":"abstract_case_blind_runtime_fixture","sha256":"7b0e2b4322b6af10d33f6fa09f87c77c4b1abd2ee583c0b589a154818be71510"}],"limitations":[],"metrics":{},"outputs":{"marginals":{"negative":0.011652802086968657,"positive":0.8115250277670384,"prior":0.18380414700826223}},"produced_by":"holdout/tools/structural_gate_harness.py","schema_version":"ncf.structural-gate-evidence.v1","status":"PASS","summary":"Directional likelihood assertions are evaluated."}
