{"architecture_gates":["G07","G08","G09","G12","G16"],"artifact_id":"schema_validation","assertions":[{"assertion_id":"frozen_schema_validation","expected":true,"observed":true,"passed":true}],"case_blind":true,"errors":[],"gate_ids":["PL-STATE-002"],"generated_at":"2026-07-21T00:05:23Z","inputs":[{"path":"ARCHITECTURE_FINAL_v1.md","role":"frozen_architecture_contract","sha256":"d83b910f3cd32c777f126b245c2652e88fccb31aaa125b455f4c5af90cc4575c"},{"path":"architecture_final_v1.schema.json","role":"frozen_wire_schema","sha256":"9804d21e8032f571b6cfd414c08b31891eab8856bc0502e0000df4b7d53f80d1"},{"path":"holdout/PERFECT_LANDING_GATES.json","role":"frozen_perfect_landing_gate_contract","sha256":"74a4e50e1b093848ba679e6ab218d68e29306166f27dfdaaccfdf09e46576b3c"},{"path":"runtime_v2/examples/neutral_factorial_model.json","role":"abstract_case_blind_runtime_fixture","sha256":"5b9f4386b24a070afeaa0967dcf46813195945d10fc175a05dc3aebe5d7283ff"}],"limitations":[],"metrics":{},"outputs":{"error":null,"runtime_version":"new-clinical-runtime/2.1","state_hash":"c4eae894ce89afb3681a509d73c9fc80ad928ae99f1cd264d9ce8e00906a07d4"},"produced_by":"holdout/tools/structural_gate_harness.py","schema_version":"ncf.structural-gate-evidence.v1","status":"PASS","summary":"Canonical state validates against the frozen structural contract."}
