{"architecture_gates":["G04","G05"],"artifact_id":"query_permutation_probe","assertions":[{"assertion_id":"queries_are_pure","expected":"54b89651b6c1141619c39eaf100e91d807fc29716f3bc26ebcf21eb0856ba52e","observed":"54b89651b6c1141619c39eaf100e91d807fc29716f3bc26ebcf21eb0856ba52e","passed":true},{"assertion_id":"query_order_invariant","expected":true,"observed":{"diagnose":1,"forecast":1,"plan":1},"passed":true}],"case_blind":true,"errors":[],"gate_ids":["PL-STATE-001"],"generated_at":"2026-07-21T09:11:12+09:00","inputs":[{"path":"ARCHITECTURE_FINAL_v1.md","role":"frozen_architecture_contract","sha256":"d83b910f3cd32c777f126b245c2652e88fccb31aaa125b455f4c5af90cc4575c"},{"path":"architecture_final_v1.schema.json","role":"frozen_wire_schema","sha256":"9804d21e8032f571b6cfd414c08b31891eab8856bc0502e0000df4b7d53f80d1"},{"path":"holdout/PERFECT_LANDING_GATES.json","role":"frozen_perfect_landing_gate_contract","sha256":"74a4e50e1b093848ba679e6ab218d68e29306166f27dfdaaccfdf09e46576b3c"},{"path":"runtime_v2/examples/neutral_factorial_model.json","role":"abstract_case_blind_runtime_fixture","sha256":"5b9f4386b24a070afeaa0967dcf46813195945d10fc175a05dc3aebe5d7283ff"}],"limitations":[],"metrics":{},"outputs":{"output_hashes":{"diagnose":["4645f9d78e5c6cbbe30a7d3590a388d5c39d6f9c12c3506d4cb83e62effca2d5","4645f9d78e5c6cbbe30a7d3590a388d5c39d6f9c12c3506d4cb83e62effca2d5","4645f9d78e5c6cbbe30a7d3590a388d5c39d6f9c12c3506d4cb83e62effca2d5","4645f9d78e5c6cbbe30a7d3590a388d5c39d6f9c12c3506d4cb83e62effca2d5","4645f9d78e5c6cbbe30a7d3590a388d5c39d6f9c12c3506d4cb83e62effca2d5","4645f9d78e5c6cbbe30a7d3590a388d5c39d6f9c12c3506d4cb83e62effca2d5"],"forecast":["993aea95c711134e1aeed47141094235366b996c9a707aa2f9cf15e4379f320f","993aea95c711134e1aeed47141094235366b996c9a707aa2f9cf15e4379f320f","993aea95c711134e1aeed47141094235366b996c9a707aa2f9cf15e4379f320f","993aea95c711134e1aeed47141094235366b996c9a707aa2f9cf15e4379f320f","993aea95c711134e1aeed47141094235366b996c9a707aa2f9cf15e4379f320f","993aea95c711134e1aeed47141094235366b996c9a707aa2f9cf15e4379f320f"],"plan":["e5a1fad7a93d08369aa7fee2c6b5699db8b5e7864dd2efdaeb61fda6886633b7","e5a1fad7a93d08369aa7fee2c6b5699db8b5e7864dd2efdaeb61fda6886633b7","e5a1fad7a93d08369aa7fee2c6b5699db8b5e7864dd2efdaeb61fda6886633b7","e5a1fad7a93d08369aa7fee2c6b5699db8b5e7864dd2efdaeb61fda6886633b7","e5a1fad7a93d08369aa7fee2c6b5699db8b5e7864dd2efdaeb61fda6886633b7","e5a1fad7a93d08369aa7fee2c6b5699db8b5e7864dd2efdaeb61fda6886633b7"]}},"produced_by":"holdout/tools/structural_gate_harness.py","schema_version":"ncf.structural-gate-evidence.v1","status":"PASS","summary":"Head calls are pure and permutation invariant."}
