{"architecture_gates":[],"artifact_id":"approved_asset_manifest","assertions":[{"assertion_id":"approved_assets_exist","expected":true,"observed":true,"passed":true}],"case_blind":true,"errors":[],"gate_ids":["PL-IND-001"],"generated_at":"2026-07-21T00:11:16Z","inputs":[{"path":"ARCHITECTURE_FINAL_v1.md","role":"frozen_architecture_contract","sha256":"d83b910f3cd32c777f126b245c2652e88fccb31aaa125b455f4c5af90cc4575c"},{"path":"architecture_final_v1.schema.json","role":"frozen_wire_schema","sha256":"9804d21e8032f571b6cfd414c08b31891eab8856bc0502e0000df4b7d53f80d1"},{"path":"holdout/PERFECT_LANDING_GATES.json","role":"frozen_perfect_landing_gate_contract","sha256":"74a4e50e1b093848ba679e6ab218d68e29306166f27dfdaaccfdf09e46576b3c"},{"path":"runtime_v2/examples/neutral_factorial_model.json","role":"abstract_case_blind_runtime_fixture","sha256":"5b9f4386b24a070afeaa0967dcf46813195945d10fc175a05dc3aebe5d7283ff"}],"limitations":[],"metrics":{},"outputs":{"assets":[{"path":"ARCHITECTURE_FINAL_v1.md","sha256":"d83b910f3cd32c777f126b245c2652e88fccb31aaa125b455f4c5af90cc4575c"},{"path":"architecture_final_v1.schema.json","sha256":"9804d21e8032f571b6cfd414c08b31891eab8856bc0502e0000df4b7d53f80d1"},{"path":"holdout/PERFECT_LANDING_GATES.json","sha256":"74a4e50e1b093848ba679e6ab218d68e29306166f27dfdaaccfdf09e46576b3c"},{"path":"holdout/tools/structural_gate_evidence.schema.json","sha256":"507fc4c44c83eaedf509b6a16b392332339fcfb84be741df901f36db29088c4f"},{"path":"holdout/tools/structural_gate_results.schema.json","sha256":"0190e2f54b51d7989d57ccc23dd4b34ccd06a7446e57cf5c2833bfc50428d0f2"},{"path":"runtime_v2/examples/neutral_factorial_model.json","sha256":"5b9f4386b24a070afeaa0967dcf46813195945d10fc175a05dc3aebe5d7283ff"}]},"produced_by":"holdout/tools/structural_gate_harness.py","schema_version":"ncf.structural-gate-evidence.v1","status":"PASS","summary":"Approved structural inputs are content-addressed."}
