{"architecture_gates":["G03"],"artifact_id":"duplicate_ingestion_probe","assertions":[{"assertion_id":"identical_duplicate_is_byte_exact","expected":"08c8ee6e2d651b3a2a586d7cecd87fbbb2f157614dc830839ab0bc5d0f29802f","observed":"08c8ee6e2d651b3a2a586d7cecd87fbbb2f157614dc830839ab0bc5d0f29802f","passed":true},{"assertion_id":"changed_duplicate_is_rejected","expected":true,"observed":true,"passed":true}],"case_blind":true,"errors":[],"gate_ids":["PL-LED-002"],"generated_at":"2026-07-20T23:54:49Z","inputs":[{"path":"ARCHITECTURE_FINAL_v1.md","role":"frozen_architecture_contract","sha256":"d83b910f3cd32c777f126b245c2652e88fccb31aaa125b455f4c5af90cc4575c"},{"path":"architecture_final_v1.schema.json","role":"frozen_wire_schema","sha256":"9804d21e8032f571b6cfd414c08b31891eab8856bc0502e0000df4b7d53f80d1"},{"path":"holdout/PERFECT_LANDING_GATES.json","role":"frozen_perfect_landing_gate_contract","sha256":"74a4e50e1b093848ba679e6ab218d68e29306166f27dfdaaccfdf09e46576b3c"},{"path":"runtime_v2/examples/neutral_factorial_model.json","role":"abstract_case_blind_runtime_fixture","sha256":"5b9f4386b24a070afeaa0967dcf46813195945d10fc175a05dc3aebe5d7283ff"}],"limitations":[],"metrics":{},"outputs":{"duplicate_hash":"2b6dc432fdf72edaf25295c5c0baa60cf59baca2861e4c00893db275215e80c5","parent_hash":"2b6dc432fdf72edaf25295c5c0baa60cf59baca2861e4c00893db275215e80c5"},"produced_by":"holdout/tools/structural_gate_harness.py","schema_version":"ncf.structural-gate-evidence.v1","status":"PASS","summary":"Exact-once duplicate delivery and collision rejection are exercised."}
