{"architecture_gates":["G06","G07","G12"],"artifact_id":"diagnostic_trace_by_cut","assertions":[{"assertion_id":"probe_completed","expected":true,"observed":false,"passed":null}],"case_blind":true,"errors":["ValueError: previous/trend exists without numeric latest for OBS_A_MARKER"],"gate_ids":["PL-DX-001"],"generated_at":"2026-07-20T23:18:44Z","inputs":[{"path":"ARCHITECTURE_FINAL_v1.md","role":"frozen_architecture_contract","sha256":"d83b910f3cd32c777f126b245c2652e88fccb31aaa125b455f4c5af90cc4575c"},{"path":"architecture_final_v1.schema.json","role":"frozen_wire_schema","sha256":"9804d21e8032f571b6cfd414c08b31891eab8856bc0502e0000df4b7d53f80d1"},{"path":"holdout/PERFECT_LANDING_GATES.json","role":"frozen_perfect_landing_gate_contract","sha256":"74a4e50e1b093848ba679e6ab218d68e29306166f27dfdaaccfdf09e46576b3c"},{"path":"runtime_v2/examples/neutral_factorial_model.json","role":"abstract_case_blind_runtime_fixture","sha256":"7b0e2b4322b6af10d33f6fa09f87c77c4b1abd2ee583c0b589a154818be71510"}],"limitations":[],"metrics":{},"outputs":{},"produced_by":"holdout/tools/structural_gate_harness.py","schema_version":"ncf.structural-gate-evidence.v1","status":"EVIDENCE_MISSING","summary":"Probe group crashed; no positive claim is made."}
