{"architecture_gates":["G01","G05"],"artifact_id":"availability_watermark_trace","assertions":[{"assertion_id":"available_cut_watermark","expected":"available-through:0.0","observed":"available-through:0.0","passed":true}],"case_blind":true,"errors":[],"gate_ids":["PL-TIME-001"],"generated_at":"2026-07-20T23:20:52Z","inputs":[{"path":"ARCHITECTURE_FINAL_v1.md","role":"frozen_architecture_contract","sha256":"d83b910f3cd32c777f126b245c2652e88fccb31aaa125b455f4c5af90cc4575c"},{"path":"architecture_final_v1.schema.json","role":"frozen_wire_schema","sha256":"9804d21e8032f571b6cfd414c08b31891eab8856bc0502e0000df4b7d53f80d1"},{"path":"holdout/PERFECT_LANDING_GATES.json","role":"frozen_perfect_landing_gate_contract","sha256":"74a4e50e1b093848ba679e6ab218d68e29306166f27dfdaaccfdf09e46576b3c"},{"path":"runtime_v2/examples/neutral_factorial_model.json","role":"abstract_case_blind_runtime_fixture","sha256":"7b0e2b4322b6af10d33f6fa09f87c77c4b1abd2ee583c0b589a154818be71510"}],"limitations":[],"metrics":{},"outputs":{"as_of":{"availability_watermark":"available-through:0.0","clock_time":null,"cut_id":"cut:0.0","event_cursor":1,"occurred_time_lower":null,"occurred_time_upper":null},"future_available_at":2},"produced_by":"holdout/tools/structural_gate_harness.py","schema_version":"ncf.structural-gate-evidence.v1","status":"PASS","summary":"Availability watermark is explicit."}
