{"architecture_gates":["G15","G16"],"artifact_id":"migration_lineage","assertions":[{"assertion_id":"refinement_has_explicit_migration_lineage","expected":"neutral-refine-v1","observed":"neutral-refine-v1","passed":true}],"case_blind":true,"errors":[],"gate_ids":["PL-REF-003"],"generated_at":"2026-07-21T09:11:12+09:00","inputs":[{"path":"ARCHITECTURE_FINAL_v1.md","role":"frozen_architecture_contract","sha256":"d83b910f3cd32c777f126b245c2652e88fccb31aaa125b455f4c5af90cc4575c"},{"path":"architecture_final_v1.schema.json","role":"frozen_wire_schema","sha256":"9804d21e8032f571b6cfd414c08b31891eab8856bc0502e0000df4b7d53f80d1"},{"path":"holdout/PERFECT_LANDING_GATES.json","role":"frozen_perfect_landing_gate_contract","sha256":"74a4e50e1b093848ba679e6ab218d68e29306166f27dfdaaccfdf09e46576b3c"},{"path":"runtime_v2/examples/neutral_factorial_model.json","role":"abstract_case_blind_runtime_fixture","sha256":"5b9f4386b24a070afeaa0967dcf46813195945d10fc175a05dc3aebe5d7283ff"}],"limitations":[],"metrics":{},"outputs":{"model_lineage":{"dynamics_digest":"0eddd873b8de5800086ff257e82c4ea56d357e886da73382ba4a27927f71c0fd","factor_graph_digest":"f8ffdf45e85e6eb67c94799d3343adc05f708b12dd6a416c13251665135acc88","geometry_digest":"cc714198b8b84a8085c9f3ba6cbdd494d74b90203a6a590d155615d71b46bfb5","migration_id":"neutral-refine-v1","mode_registry_digest":"71f51225af01d294778adbc32babf665243c32af23a94d53672b5c58b74c1cb0","model_digest":"f498a741ed2e24abb8961d7e916eb1ebc53a56912277d1bfc8d1fee83fcb1319","model_id":"neutral-local-refinement-v1","model_version":"2.1","parent_model_digest":"aa9c836e2fc360fa61813e4ca2be411bf65dbe6a559260e9b9d1b9a30fca2efe","process_registry_digest":"d3fc541a487eadd0e7eb08ccd25154d7d0b6d641c5284271eddbc66515db2cc3"}},"produced_by":"holdout/tools/structural_gate_harness.py","schema_version":"ncf.structural-gate-evidence.v1","status":"PASS","summary":"Local refinement is versioned and migrated explicitly."}
